title,url
Large Language Models for Software Engineering: Survey and Open Problems,https://arxiv.org/abs/2310.03533
A Survey on Large Language Models for Software Engineering,https://arxiv.org/abs/2312.15223
A Comprehensive Overview of Backdoor Attacks in Large Language Models within Communication Networks,https://arxiv.org/abs/2308.14367
The DevOps Handbook,https://www.oreilly.com/library/view/the-devops-handbook/9781457191381/
Security Challenges for Cloud or Fog Computing-Based AI Applications,https://arxiv.org/abs/2310.19459
Green Edge AI: A Contemporary Survey,https://arxiv.org/abs/2312.00333
Blockchain for Edge of Things,https://arxiv.org/abs/2110.05022
